,Sector,Category,Crop,QueryType,QueryText,KccAns,DistrictName,isPaddy
11181,AGRICULTURE,Cereals,Paddy (Dhan),Fertilizer Use and Availability,fertilizer dose in Paddy during tillering stage,"Recommended to apply 30kg Urea,15kg MOP and 5kg Dhanzyme gold per acre as fertilizer dose in Paddy during tillering stage.",BARGARH,1
11182,AGRICULTURE,Cereals,Paddy (Dhan),	Plant Protection	,Stem borer attack in paddy,Recommended to spray caldan (Cartap hydrochloride 50% SP @ 400 g per 200 litre of water per 1 acre of land (2 g in 1 Litre water),BARGARH,1
11183,AGRICULTURE,Cereals,Paddy (Dhan),	Plant Protection	,Brown spot disease in paddy,Recommended to spray(antracol) Propineb 70 % WP @ 800 g per 200 litre of water per 1 acre of land (4 g in 1 Litre water) (60g/15lt of water ),BARGARH,1
11186,AGRICULTURE,Cereals,Paddy (Dhan),Weed Management,Weed management in paddy ,Recommended to spray Bispyribac sodium 10% SC (Nominee gold) @ 80 ml per 200 litre of water per 1 acre of land (6 ml per 15 litre of water),BARGARH,1
11187,AGRICULTURE,Cereals,Paddy (Dhan),Nutrient Management,Fertilizer requirement in paddy as 2nd doses,Apply 20kg urea+10kg zinc sulphate or maha zinc@5 kg or Dhanzyme gold (granule) @ 5 kg +Ferterra 0.4% GR (chlorantraniliprole) @ 4 kg ,BARGARH,1
11191,AGRICULTURE,Cereals,Paddy (Dhan),	Plant Protection	,When to apply  ferterra in paddy,Recommended to apply Ferterra ( Chlorantraniliprole 0.4 % GR ) @ 4 kg per acre of land during tillering time  for preventive for stem borer in paddy.,BARGARH,1
11192,AGRICULTURE,Cereals,Paddy (Dhan),	Plant Protection	,Stem borer in paddy,Advised to wait for 4 days after spray of  (Chlorpyrifos 50% and Cypermethrin 5% w/w) @ 2 ml per litre or 30 ml per 15 litre water to control paddy yellow stem borer.,BARGARH,1
11193,AGRICULTURE,Cereals,Paddy (Dhan),Fertilizer Use and Availability,For better tillering in paddy,"Recommended to apply fertilizer of urea-25kg, potash-10kg, zinc sulphate-10kg/acre for better tillering in paddy.",BARGARH,1
11195,AGRICULTURE,Cereals,Paddy (Dhan),Nutrient Management,3rd dose for Fertilizer application in paddy,3rd dose for Fertilizer application in paddy then Urea @ 20 kg and MOP @ 15 kg per acre as 3rd dose for Fertilizer application in paddy.,BARGARH,1
11196,AGRICULTURE,Cereals,Paddy (Dhan),Fertilizer Use and Availability,   ,"cହିସାବ ରେ ୟୁରିଆ ୨୦ କେଜି, Zinc sulphate ୧୦ କେଜି ଏକର କୁ ଦେବେ + ପିଲ ବଢେଇବା ପାଇଁ Dhanzyme gold (granule) @ ୫ କେଜି କୁ ୨୦ କେଜି ବାଲି କିମ୍ବା Sagarika(Liquid micronutrient) @ ୨ ମିଲି କୁ ୧ ଲିଟର ପାଣି ରେ ମିଶେଇ ସ୍ପ୍ରେ କରିପାରିବେ ,Ferterra କିମ୍ବା  Thimet @ 4 kg ଏକର ପିଛା ପ୍ରୟୋଗ କରନ୍ତୁ
",BARGARH,1
11202,AGRICULTURE,Cereals,Paddy (Dhan),	Plant Protection	,White grub stem borer in paddy ,Recommended to apply 5 kg Thimet 10g+15 kg sand per acre to control White grub /stem borer in paddy ,BARGARH,1
11203,AGRICULTURE,Cereals,Paddy (Dhan),	Plant Protection	,for controlling Stem borer in Paddy field,Recommended to spray Cartap hydrochloride 50SP @ 400gm per acre for controlling Stem borer in Paddy field.,BARGARH,1
11204,AGRICULTURE,Cereals,Paddy (Dhan),	Plant Protection	,for controlling Stem borer in Paddy,Recommended to spray Cartap hydrochloride 50SP @ 400gm per acre for controlling Stem borer in Paddy.,BARGARH,1
11207,AGRICULTURE,Cereals,Paddy (Dhan),Weed Management,How to control weed infestation in paddy 21 days old,Recommended to spray Vivaya (Cyhalofop-Butyl 5.1% + Penoxsulam 1.02% OD)@800ml/acre(4ml/lt of water),BARGARH,1
11213,AGRICULTURE,Cereals,Paddy (Dhan),	Plant Protection	,Stem borer in paddy,ଧାନ ରେ କାଣ୍ଡବିନ୍ଧା ପୋକ ର ନିୟନ୍ତ୍ରଣ ପାଇଁ Cartap hydrochloride ୫୦% SP @ ୪୦୦ ଗ୍ରାମ କୁ ୨୦୦ ଲିଟର ପାଣି ରେ ମିଶେଇ ସ୍ପ୍ରେ କରିବେ ( ୨ ଗ୍ରାମ କୁ ୧ ଲିଟର ପାଣି),BARGARH,1
11215,AGRICULTURE,Cereals,Paddy (Dhan),Fertilizer Use and Availability,Fertilizer dose for paddy,Recommended to apply urea-25kg/acre.,BARGARH,1
11217,AGRICULTURE,Cereals,Paddy (Dhan),	Plant Protection	,For better  growth in paddy,"--Recommended to apply fertilizer in paddy urea-30kg,  zinc sulphate-10kg, sagarika z++ -10kg/ acre for better growth in the paddy.",BARGARH,1
11218,AGRICULTURE,Cereals,Paddy (Dhan),Fertilizer Use and Availability,"For better growth and fruiting in Paddy
",Recommended to spray NPK(19:19:19)100gm+Ambition 30ml in 15 liters water for better growth and fruiting in Paddy,BARGARH,1
11219,AGRICULTURE,Cereals,Paddy (Dhan),	Plant Protection	,Blast in paddy ,Recommended to spray Trifloxystrobin 25% + Tebuconazole 50% @ 80 g per acre in 200 litres of water per acre of land (6gm per 15 litres of water),BARGARH,1
11222,AGRICULTURE,Cereals,Paddy (Dhan),Nutrient Management,Better growth in paddy,Recommended to apply humic gold @ 5 kg per acre for Better growth in paddy,BARGARH,1
11224,AGRICULTURE,Cereals,Paddy (Dhan),	Plant Protection	,"Stem borer in paddy
  ","Recommended to spray Fipronil 5% SC @ 400 ml per 200 litre of water per 1 acre of land (30ml in 15 litre water) for Stem borer in paddy
  ",BARGARH,1
11225,AGRICULTURE,Cereals,Paddy (Dhan),Nutrient Management,NPK 191919 Dose ,Recommended to spray Polyfeed ( 19:19:19 ) @ 1500 g per 200 litre of water per 1 acre of land (100 g / 15 liter) ,BARGARH,1
11234,AGRICULTURE,Cereals,Paddy (Dhan),	Plant Protection	,Stem borer in Paddy,Recommended to spray Fipronil 5% SC @ 500 ml per 200 litre of water per 1 acre of land for control of Stem borer in Paddy,BARGARH,1
11236,AGRICULTURE,Cereals,Paddy (Dhan),	Plant Protection	,Bacterial leaf blight in paddy,"Recommended to spray Copper Oxychloride 600 g + Plantomycin 200 g in 200 litre of water per 1 acre of land (Copper Oxychloride @ 45 g + Plantomycin 15 g in 15 Litre water) to control Bacterial leaf blight in Paddy.
",BARGARH,1
11237,AGRICULTURE,Cereals,Paddy (Dhan),	Plant Protection	,Bacterial leaf blight in paddy ,Recommended to spray Copper Oxychloride 600 g + Plantomycin 200 g in 200 litre of water per 1 acre of land (Copper Oxychloride @ 45 g + Plantomycin 15 g in 15 Litre water) to control Bacterial leaf blight in Paddy.,BARGARH,1
11238,AGRICULTURE,Cereals,Paddy (Dhan),Fertilizer Use and Availability,Second dose of fertilizer for Paddy and for good plant growth in Paddy,"Recommended to apply Urea @ 26 kg, Zinc sulphate @ 10 kg, as second dose and to spray Sagarika @2ml per 1 litre of water for good plant growth in Paddy.",BARGARH,1
11241,AGRICULTURE,Cereals,Paddy (Dhan),	Plant Protection	,Bacterial leaf blight in Paddy,Recommended to spray Copper Oxychloride 600 g + Plantomycin 200 g in 200 litre of water per 1 acre of land (Copper Oxychloride @ 45 g + Plantomycin 15 g in 15 Litre water) to control Bacterial leaf blight in Paddy.,BARGARH,1
11242,AGRICULTURE,Cereals,Paddy (Dhan),Nutrient Management,Growth regulator for increasing tillering in paddy,Recommended to spray dhanzyme gold @ 200 ml per 200 litre of water per 1 acre of land (1ml per lit of water)  to increase tillering  in paddy.,BARGARH,1
11244,AGRICULTURE,Cereals,Paddy (Dhan),	Plant Protection	,Stem borer in paddy,Recommended to spray Fipronil 5% SC @ 400 ml per 200 litre of water per 1 acre of land (30ml in 15 litre water) for Stem borer in paddy,BARGARH,1
11248,AGRICULTURE,Cereals,Paddy (Dhan),Weed Management,Weed management in paddy,Recommended to hand weeding after 7days of weedicide spray in paddy.,BARGARH,1
11250,AGRICULTURE,Cereals,Paddy (Dhan),	Plant Protection	,Stem borer attack in paddy , Canon (Cypermethrin - 5% + Chloropyriphos - 50% ) @ 400 ml per 200 litre of water + Syngenta Virtako ( @ 2.5 kg ),BARGARH,1
11259,AGRICULTURE,Cereals,Paddy (Dhan),Fertilizer Use and Availability,Tillering stage fertiliser application ,Recommended to apply 20kg Urea+Fertera 4kg+Dhanzyme gold 5kg+Zinc sulphate 10kg per acre of land,BARGARH,1
11260,AGRICULTURE,Cereals,Paddy (Dhan),	Water Management	,Water management related query in Paddy,Advised to give water after 24 to 30hrs of applying fertilizer.,BARGARH,1
11262,AGRICULTURE,Cereals,Paddy (Dhan),	Plant Protection	,Hardening of soil in paddy cultivation ,Recommended to apply Zypmite plus @25kg per acre of land ,BARGARH,1
11270,AGRICULTURE,Cereals,Paddy (Dhan),	Plant Protection	,Fungicide control in Paddy,Recommended to spray Bispyribac sodium 10% SC (Nominee gold) @ 80 ml per 200 litre of water per 1 acre of land (6 ml per 15 litre of water) as post emergence herbicide spray in Paddy. ,BARGARH,1
11276,AGRICULTURE,Cereals,Paddy (Dhan),	Plant Protection	,Stem borer in paddy,Recommended to spray Fipronil 5% SC @ 400 ml per 200 litre of water per 1 acre of land (30ml in 15 litre water)  for control of stem borer in paddy.,BARGARH,1
11280,AGRICULTURE,Cereals,Paddy (Dhan),Nutrient Management,Third dose fertilizer application in paddy,Recommended to apply Urea @ 20 kg and MOP @ 5 kg per acre as 3rd dose for fertilizer application in paddy.,BARGARH,1
11284,AGRICULTURE,Cereals,Paddy (Dhan),Nutrient Management,Better growth in paddy,Recommended to spray Multi K (13:0:45) @ 1500 gm per 200 litre of water per 1 acre of land (100 g / 15 liter) for Better growth in paddy,BARGARH,1
11285,AGRICULTURE,Cereals,Paddy (Dhan),Fertilizer Use and Availability,Fertilizer dose for paddy ," Urea @ 20 kg,  Maha zinc @ 5 kg and syngenta virtako -2.5kg  per acre as Second fertiliser dose in Paddy.",BARGARH,1
11286,AGRICULTURE,Cereals,Paddy (Dhan),	Plant Protection	,Yellow stem borer attack in paddy ,Canon (Cypermethrin - 5% + Chloropyriphos - 50% ) @ 400 ml per 200 litre of water per 1 acre of land to control ,BARGARH,1
11287,AGRICULTURE,Cereals,Paddy (Dhan),	Plant Protection	,Yellow stem borer Infestation in paddy,ଧାନ ରେ କାଣ୍ଡ ବିନ୍ଧା ର ନିୟନ୍ତ୍ରଣ ପାଇଁ  Canon (Cypermethrin - ୫% + Chloropyriphos - ୫୦ % ) @ ୪୦୦ ମିଲି କୁ ୨୦୦ ଲିଟର ପାଣି ରେ ମିଶେଇ ଏକର କୁ ସ୍ପ୍ରେ କରିବେ.,BARGARH,1
11294,AGRICULTURE,Cereals,Paddy (Dhan),	Plant Protection	,Stem borer in paddy,Recommended Koranda 505 (Chlorpyrifos 50% and Cypermethrin 5% w/w) @ 2 ml per litre or 30 ml per 15 litre water to control paddy   stem borer.,BARGARH,1
11305,AGRICULTURE,Cereals,Paddy (Dhan),Weed Management,weed management in Paddy ,Recommended to spray Bispyribac sodium 10%EC (Nominee gold) @ 80 ml with 200 liter of water per acre for weed management in Paddy .,BARGARH,1
11306,AGRICULTURE,Cereals,Paddy (Dhan),Cultural Practices,For better plant growth in Paddy,Recommended to spray sagarika @ 400 ml per 200 litre of water per 1 acre of land  for better plant growth in Paddy.,BARGARH,1
11310,AGRICULTURE,Cereals,Paddy (Dhan),	Plant Protection	,Stem borer in Paddy,"Recommended to spray Flubendiamide 20% WG@ 7g in 15 liter water to control Stem borer in Paddy.
",BARGARH,1
11318,AGRICULTURE,Cereals,Paddy (Dhan),	Plant Protection	,Stem borer in paddy,"Recommended to spray Fipronil 5% SC @ 400 ml per 200 litre of water per 1 acre of land (30ml in 15 litre water) for control of stem borer in paddy.
  ",BARGARH,1
11319,AGRICULTURE,Cereals,Paddy (Dhan),Weed Management,post emergence weeds in paddy ,"Recommended to spray 2,4 d (Amino salt) 500ml+Almix 8gm in 200 liters water per acre to control post emergence weeds in paddy ",BARGARH,1
11322,AGRICULTURE,Cereals,Paddy (Dhan),	Plant Protection	,Thrips and Yellow stem borer in Paddy,Recommended to spray Regent (Fipronil 5% SC) @ 2 ml/l to control Thrips and Yellow stem borer in Paddy.,BARGARH,1
11323,AGRICULTURE,Cereals,Paddy (Dhan),Weed Management,Weed management in paddy,Recommended to spray council active @ 90 gm Per acre . ,BARGARH,1
11324,AGRICULTURE,Cereals,Paddy (Dhan),	Plant Protection	,Brown plant hopper in Rice,"Recommended to spray Imagine upl (Flupyrine 10 % SC) @ 2 ml per litre to control Brown plant hopper in Rice.
",BARGARH,1
11334,AGRICULTURE,Cereals,Paddy (Dhan),	Plant Protection	,Stem borer in Paddy ,"Recommended to spray Flubendiamide 480 SC @ 40 ml per 200 litre of water per 1 acre of land  (3ml Per 15 Liter water) to control Stem borer in Paddy 
",BARGARH,1
11340,AGRICULTURE,Cereals,Paddy (Dhan),Nutrient Management,Nutrient management in paddy ,"Dhanuka Dhanzyme gold (granule) @ 5 kg per acre or Iffco Sagarika z++ @ 8-10 kg per acre for For better tillering in Paddy.
",BARGARH,1
11344,AGRICULTURE,Cereals,Paddy (Dhan),	Plant Protection	,Case worm Infestation In Paddy, Recommended to spray Fipronil ୫% SC @ ୪୦୦ ମିଲି କୁ ୨୦୦ ଲିଟର ପାଣି ରେ ମିଶେଇ ଏକର କୁ ସ୍ପ୍ରେ କରିବେ .,BARGARH,1
11345,AGRICULTURE,Cereals,Paddy (Dhan),	Plant Protection	,Gall midge attack in paddy ,(Chloropyriphos 50 EC + Cypermethrin 5% EC ) @ 400 ml per 200 litre of water.,BARGARH,1
11346,AGRICULTURE,Cereals,Paddy (Dhan),Cultural Practices,Paddy cultural practice,--Advised to go for sowing and then go for weed management.,BARGARH,1
11349,AGRICULTURE,Cereals,Paddy (Dhan),Fertilizer Use and Availability,For better growth of the paddy,Recommended to apply  Iffco Sagarika z++ @ 8-10 kg per acre for for better growth in Paddy.,BARGARH,1
11352,AGRICULTURE,Cereals,Paddy (Dhan),	Plant Protection	,Sheath Rot in rice ,"Recommended to spray Azoxystrobin 18.2% W/W + Difenconazole 11.4% W/W SC @ 200 ml per 200 litre of water per 1 acre of land + Validamycin 3% L @ 2ml per liter.
",BARGARH,1
11355,AGRICULTURE,Cereals,Paddy (Dhan),Weed Management,weed management in rice ,Recommended to spray Bispyribac sodium 10 % SC ( Nominee gold )  @ 80 ml per 200 litre of water per 1 acre of land +Almix (Dupont) Metsulfuron methyl 10% + Chlorimuron ethyl 10% WP @ 8 gm per 200 litre of water per acre of land  .,BARGARH,1
11356,AGRICULTURE,Cereals,Paddy (Dhan),Weed Management,Pre emergence weed management in paddy,Recommended to  apply  Pretilachlor 50 %EC @ 320 ml Per Acre Of Land Or Mixing With 15-20kg Of Sand as pre emergence weedicide in paddy. ,BARGARH,1
11357,AGRICULTURE,Cereals,Paddy (Dhan),Weed Management, post emergence weeds in paddy ,--Recommended to apply Nominee Gold (Bispyribac-Sodium 10% SC)80ml in 15 liters water per acre  to control post emergence weeds in paddy ,BARGARH,1
11363,AGRICULTURE,Cereals,Paddy (Dhan),Fertilizer Use and Availability,Panicle initiation fertiliser application ,Recommended to apply Urea=18kg+MOP=12 kg per acre of land,BARGARH,1
11365,AGRICULTURE,Cereals,Paddy (Dhan),	Plant Protection	,Stem Borer infestation in Paddy ,"Recommended to spray Emamectin Benzoate 5 % SG @ 80 g per 200 litre of water per 1 acre of land (6 g per 15 Litre water) in Paddy 
",BARGARH,1
11366,AGRICULTURE,Cereals,Paddy (Dhan),Nutrient Management,Can I use nano urea and insecticide together,"No, there is no proven method for such application of  nano urea and insecticide together.",BARGARH,1
11368,AGRICULTURE,Cereals,Paddy (Dhan),	Plant Protection	,Yellow stem Borer infestation in paddy,Recommended to spray (Chloropyriphos 50 EC + Cypermethrin 5% EC ) @ 400 ml per 200 litre of water per 1 acre of land to control Yellow stem Borer infestation in paddy.,BARGARH,1
11374,AGRICULTURE,Cereals,Paddy (Dhan),Fertilizer Use and Availability,Dose of zinc sulphate ,Recommended the dose of zinc sulphate of @10kg/acre.,BARGARH,1
11375,AGRICULTURE,Cereals,Paddy (Dhan),	Plant Protection	,Sheath blight in paddy ,Recommended to spray Hexaconazole 5%ec 30ml in 15 liters water to control Sheath blight in paddy ,BARGARH,1
11376,AGRICULTURE,Cereals,Paddy (Dhan),	Plant Protection	,"Bacterial leaf blight in paddy
","Recommended to spray Copper oxychloride 600 gram + plantomycin 200 gram per acre with 200 litre of water for Control of Bacterial leaf blight in paddy
",BARGARH,1
11379,AGRICULTURE,Cereals,Paddy (Dhan),Weed Management,Weed infestation in Rice after 1 and half month of Transplanting in Paddy,Advise to go for Hand Weeding in Paddy,BARGARH,1
11386,AGRICULTURE,Cereals,Paddy (Dhan),	Plant Protection	,Stem borer in paddy,Recommended to spray Marker ( Bifenthrin 10 % EC ) @ 400 ml per 200 litre of water per 1 acre of land for control of  stem borer in paddy.,BARGARH,1
11388,AGRICULTURE,Cereals,Paddy (Dhan),Fertilizer Use and Availability,Polyhalite Use,"Polyhalite is an evaporite mineral, a hydrated sulfate of potassium, calcium and magnesium ... Polyhalite is used as a fertilizer",BARGARH,1
11389,AGRICULTURE,Cereals,Paddy (Dhan),Nutrient Management,For better growth of paddy ,Recommended to apply Sagarika 10 kg per acre for better growth of paddy ,BARGARH,1
11390,AGRICULTURE,Cereals,Paddy (Dhan),	Plant Protection	,POST EMERGENCE HERBICIDE,Recommended to spray Bayer Nabood (Carfentranozole ethyl 40% DF) @ 20 gm per acre to control weed from paddy field.,BARGARH,1
11393,AGRICULTURE,Cereals,Paddy (Dhan),Weed Management,About Narkis herbicide,"
Narkis
A post-emergent rice herbicide. With Bispyribac Sodium 10%, Narkis helps farmers control different groups of grasses, sedges, and broad-leaf weeds.Dose -100 ml per acre.",BARGARH,1
11398,AGRICULTURE,Cereals,Paddy (Dhan),	Plant Protection	,Leaf hoppers and Root rot in Paddy,"Recommended to spray Regent (Fipronil 5% SC) @ 2 ml/l to control Leaf hoppers in Paddy.
Recommended to soil drench with SAAF (Carbendazim- 12% + Mancozeb - 63% ) @ 600 g per 200 litre of water per 1 acre of land (3 g in 1 Litre water) to control Root rot in Paddy.",BARGARH,1
11400,AGRICULTURE,Cereals,Paddy (Dhan),Nutrient Management,Role of dap in paddy ,Advise-it will help for root and shoot development and also help in increase the yield ,BARGARH,1
11401,AGRICULTURE,Cereals,Paddy (Dhan),Nutrient Management,First second and third dose of fertilizer in paddy,"Paddy basal dose-5kg urea+35kg dap or Gromor (28-28-0) @ 50 kg +15kg mop,2nd dose-apply 20kg urea+10kg zinc sulphate or maha zinc@5 kg or Dhanzyme gold (granule) @ 5 kg +Ferterra 0.4% GR (chlorantraniliprole) @ 4 kg and 3rd dose-Urea @ 20 kg +MOP @ 10 kg",BARGARH,1
11402,AGRICULTURE,Cereals,Paddy (Dhan),Weed Management,Weed management in paddy,"Recommended to spray Bispyribac sodium 10%EC (Nominee gold, Fuzi super) @ 80ml with 200 liter of water per acre  (6ml/15lit water)  for weed management in paddy.",BARGARH,1
11403,AGRICULTURE,Cereals,Paddy (Dhan),	Plant Protection	,Leaf hoppers in paddy,Recommended to spray Regent (Fipronil 5% SC) @ 2 ml/l to control Leaf hoppers in paddy.,BARGARH,1
11405,AGRICULTURE,Cereals,Paddy (Dhan),	Plant Protection	,Effect of expired fungicide application on crops,Advised to avoid application of expired fungicide on paddy as it can be toxic for the crops. ,BARGARH,1
11410,AGRICULTURE,Cereals,Paddy (Dhan),Cultural Practices,Weed management in paddy,Recommended to spray Pyrazosulphuron ethyl 10% WP ( Saathi ) @ 80 g per 200 litre of water per 1 acre of land (6 g per 15 litre of water) for weed management in paddy.,BARGARH,1
11411,AGRICULTURE,Cereals,Paddy (Dhan),Fertilizer Use and Availability,Fertilizer dose in Paddy during tillering stage,"Recommended to apply 30kg Urea,5kg Dhanzyme gold per acre as Fertilizer dose in Paddy during tillering stage.",BARGARH,1
11416,AGRICULTURE,Cereals,Paddy (Dhan),Weed Management,Jokato herbicide dose,Recommended to spray Jokato herbicide ( Bispyribac Sodium 10% SC)  @ 120 ml per acre of land as post emergence herbicide. ,BARGARH,1
11418,AGRICULTURE,Cereals,Paddy (Dhan),Nutrient Management,Multiplex kranti micronutrient dose,Recommended to spray Multiplex kranti micronutrient @ 2ml per lit of water to enhance growth and development in paddy. ,BARGARH,1
11420,AGRICULTURE,Cereals,Paddy (Dhan),	Plant Protection	,Blast in paddy,Recommended to spray Nativo (Tebuconazole 50% + Trifloxystrobin 25% WG) @ 100 g in 200 Litre water (8 g in 15 Litre water) per acre to contol of blast in paddy.,BARGARH,1
11421,AGRICULTURE,Cereals,Paddy (Dhan),	Plant Protection	,Bacterial Leaf Blight in paddy,Recommended to spray Copper Oxychloride 600 g + Plantomycin 200 g in 200 litre of water per 1 acre of land (Copper Oxychloride @ 45 g + Plantomycin 15 g in 15 Litre water) to control Bacterial leaf blight in Paddy. ,BARGARH,1
11423,AGRICULTURE,Cereals,Paddy (Dhan),Fertilizer Use and Availability,Nano Urea Dose in Paddy ,"Recommended to spray Nano urea @ 4  ml per litre of water  in Paddy 
",BARGARH,1
11431,AGRICULTURE,Cereals,Paddy (Dhan),	Plant Protection	,Stem borer in paddy ,Recommended to spray Caldan 50%sp 30gm in 15 liters water to control Stem borer in paddy ,BARGARH,1
11433,AGRICULTURE,Cereals,Paddy (Dhan),Cultural Practices,Panicle emergence in paddy ,"Recommended to spray Urea-20 kg,MOP-10kg  to control Panicle emergence in paddy.",BARGARH,1
11434,AGRICULTURE,Cereals,Paddy (Dhan),	Plant Protection	,Bacterial leaf blight in paddy,"Recommended to spray Copper oxychloride 600 gram + plantomycin 200 gram per acre with 200 litre of water for Control of Bacterial leaf blight in paddy
",BARGARH,1
11436,AGRICULTURE,Cereals,Paddy (Dhan),	Plant Protection	,Stem borer in paddy,Recommended to spray Fipronil 5% SC @ 400 ml per 200 litre of water per 1 acre of land (30ml in 15 litre water)  for control of stem borer in paddy.,BARGARH,1
11437,AGRICULTURE,Cereals,Paddy (Dhan),Fertilizer Use and Availability,For better growth in paddy,Recommended to spray dhanzyme gold @ 200 ml per 200 litre of water per 1 acre of land  and urea-25kg/acre.,BARGARH,1
11445,AGRICULTURE,Cereals,Paddy (Dhan),	Plant Protection	,Stem borer in Paddy ,Recommended to spray Caldan 50%sp 30ml in 15 liters water to control Stem borer in Paddy ,BARGARH,1
11449,AGRICULTURE,Cereals,Paddy (Dhan),Cultural Practices,for better growth in Paddy field,Recommended to spray IFFCO Nano Urea @ 4ml per liter water for better growth in Paddy field.,BARGARH,1
11450,AGRICULTURE,Cereals,Paddy (Dhan),	Plant Protection	,Precaution against pest in Paddy field,Recommended to apply Fipronil 0.3GR @ 5kg per acre as Precaution against pest in Paddy field.,BARGARH,1
11451,AGRICULTURE,Cereals,Paddy (Dhan),Fertilizer Use and Availability,Fertilizer dose in Paddy during panicle stage,Recommended to apply 15kg Urea and 15kg MOP per acre as Fertilizer dose in Paddy during panicle stage.,BARGARH,1
11453,AGRICULTURE,Cereals,Paddy (Dhan),	Plant Protection	,Root rot in paddy,Recommended to soil drench with SAAF (Carbendazim- 12% + Mancozeb - 63% ) @ 600 g per 200 litre of water per 1 acre of land (3 g in 1 Litre water) to control Root rot in Paddy,BARGARH,1
11455,AGRICULTURE,Cereals,Paddy (Dhan),	Plant Protection	,Leaf blight in paddy,Recommended to spray carbendazim 50% wg @ 2gram/1 ltr water,BARGARH,1
11460,HORTICULTURE,Vegetables,Pointed Gourd,	Plant Protection	,Stem borer in paddy,Recommended to spray (Shooter 50 )Lambda Cyhalothrin 4.9 % CS @ 400 ml per 200 litre of water in 1 acre of land to control Stem borer in paddy,BARGARH,1
11465,AGRICULTURE,Cereals,Paddy (Dhan),	Plant Protection	,Blast in Paddy Fijione,Recommended to spray Isoprothiolane 40% EC@ 300 ml per 200 litre of water per acre (1.5 ml/ litre of water) to control Blast in Paddy (Fijione),BARGARH,1
11471,AGRICULTURE,Cereals,Paddy (Dhan),Nutrient Management,Yellowing of lower leaves in paddy ,Advise to spray  npk(19:19:19)@100g/15lt of water ,BARGARH,1
11472,AGRICULTURE,Cereals,Paddy (Dhan),	Plant Protection	,Bacterial Leaf blight in Paddy field,Recommended to spray Copper Oxychloride 50%WP @ 600gm and Plantomycin @ 200gm per acre for controlling Bacterial Leaf blight in Paddy field.,BARGARH,1
11474,AGRICULTURE,Cereals,Paddy (Dhan),	Plant Protection	,Stem borer in paddy,Recommended to spray CORAGEN (Chlorantraniliprole 18.5 % sc ) @ 60 ml per acre of land to control stem borer in paddy. ,BARGARH,1
11476,AGRICULTURE,Cereals,Paddy (Dhan),Fertilizer Use and Availability,To know about the mix of urea and potash for spray in paddy,Reommended that it is safe to use mix of urea and potash for the spray in paddy.,BARGARH,1
11480,AGRICULTURE,Cereals,Paddy (Dhan),Fertilizer Use and Availability,Fertilizer application  at Panicle initiation stage in paddy ,Recommended to apply 18 kg Urea+15 kg MOP+10kg Sagarika per acre at Panicle initiation stage in paddy ,BARGARH,1
11486,AGRICULTURE,Cereals,Paddy (Dhan),	Plant Protection	,Stem borer in paddy,Recommended to spray Fipronil 5% SC @ 400 ml per 200 litre (2ml/1lit) of water per 1 acre of land for control of stem borer in paddy.,BARGARH,1
11487,AGRICULTURE,Cereals,Paddy (Dhan),	Plant Protection	,Bacterial Leaf Blight disease in paddy,Recommended to spray Copper Oxychloride @ 600 g + Plantomycin @ 200 g in 200 litre of water per 1 acre of land (Copper Oxychloride @ 45 g + Plantomycin @ 15 g in 15 Litre water) to control Bacterial leaf blight in Paddy.,BARGARH,1
11489,AGRICULTURE,Cereals,Paddy (Dhan),Weed Management,Weed management in paddy,"Recommended to apply Penoxsulam 21.7% SC (Penoxa) @ 37.5ml per acre for control of  weeds like grasses, sedges and broad leaved weeds of transplanted rice crop.

",BARGARH,1
11494,AGRICULTURE,Cereals,Paddy (Dhan),Weed Management,Weed management in paddy,"Recommended to spray Pyrazosulphuron ethyl 10% WP ( Saathi ) @ 80 g per 200 litre of water per 1 acre of land (6 g per 15 litre of water) for weed management in Paddy within 
",BARGARH,1
11495,AGRICULTURE,Cereals,Paddy (Dhan),Weed Management,"Weed management in paddy
","Weed management in paddy - Advised for hand weeding.
",BARGARH,1
11499,AGRICULTURE,Cereals,Paddy (Dhan),	Plant Protection	,Stem borer in paddy,Recommended to spray Fipronil 5% SC @ 400 ml per 200 litre of water per 1 acre of land (30ml in 15 litre water) for control of stem borer in paddy.,BARGARH,1
