,Sector,Category,Crop,QueryType,QueryText,KccAns,DistrictName,isPaddy
17382,AGRICULTURE,Cereals,Paddy (Dhan),Weed Management,Post emergence weed management in paddy,"Recommended to apply Almix (Metsulfuron methyl 10% + Chlorimuron ethyl 10% WP) @ 8 g + 2,4- D @ 500 g + 20 kg sand to control Post emergence weed in Paddy. 
 ",BARGARH,1
17387,AGRICULTURE,Cereals,Paddy (Dhan),Weed Management,weed management in Paddy,"Recommended to spray 2,4-D Sodium salt @ 500gm + Almix (Metsulfuron Methyl 10% + Chlorimuron Ethyl 10%) @ 8gm with 200 liter of water per acre for weed management in Paddy.",BARGARH,1
17389,AGRICULTURE,Cereals,Paddy (Dhan),Fertilizer Use and Availability,2nd dose fertilizer for paddy,"Urea @ 25 kg, Zinc sulphate @ 10 kg, Ferterra @ 4 kg , Dhanzyme gold 5kg, MOP 10kg (granule)per acre 21 days after transplanting",BARGARH,1
17393,AGRICULTURE,Cereals,Paddy (Dhan),Weed Management,Post emergence weed management in Paddy,"Recommended to spray 2, 4- DIMETHYL AMINE SALT 58 % SL@ 500 ml per 200 litre of water per 1 acre of land (2.5ml per lit of water) as post emergence weed management in Paddy.
  ",BARGARH,1
17395,AGRICULTURE,Cereals,Paddy (Dhan),Fertilizer Use and Availability,Fertilizer dose for paddy,"Recommended the fertilizer dose for paddy urea-26kg, zinc sulphate-10kg, potash-5kg, carbofuran 4G -10kg/acre.",BARGARH,1
17398,AGRICULTURE,Cereals,Paddy (Dhan),Fertilizer Use and Availability,Fertilizer dose for paddy,"Recommended the for paddy urea-26kg, zinc sulphate-10kg,fertera-4kg/acre.",BARGARH,1
17401,AGRICULTURE,Cereals,Paddy (Dhan),Weed Management,Weed management,Advise not to use herbicide,BARGARH,1
17405,AGRICULTURE,Cereals,Paddy (Dhan),Cultural Practices,Protection from weedicide,Advised to spray water immediately after the spray of weedicide.,BARGARH,1
17406,AGRICULTURE,Cereals,Paddy (Dhan),Weed Management, Paraquat Dichloride 24 SL dose,"Recommended to spray Paraquat Dichloride 24% SL @ 800 ml per 200 litre of water per acre of land (works in 24 hours, rainfall after 2 hours is good, After 1 week we can sow seeds). ",BARGARH,1
17409,AGRICULTURE,Cereals,Paddy (Dhan),Weed Management,weed management in Paddy,"Recommended to spray 2,4-D Sodium salt @ 500gm + Almix (Metsulfuron Methyl 10% + Chlorimuron Ethyl 10%) @ 8gm with 200 liter of water per acre for weed management in Paddy.",BARGARH,1
17412,AGRICULTURE,Cereals,Paddy (Dhan),Weed Management,Paraquat application in paddy,Advised to spray water in the crops as it will neutralise paraquat application.,BARGARH,1
17415,AGRICULTURE,Cereals,Paddy (Dhan),	Plant Protection	,Grasshopper and stem borer  infestation in paddy,Recommended to spray Bayer Regent or Iffco Shinzan plus Fipronil 5% SC @ 400 ml per 200 litre of water per 1 acre of land (30ml in 15 litre water) ,BARGARH,1
17420,AGRICULTURE,Cereals,Paddy (Dhan),Nutrient Management,Bacterial leaf blight problem in paddy,Recommended to spray Copper Oxychloride 600 g + Plantomycin 200 g in 200 litre of water per 1 acre of land (Copper Oxychloride @ 45 g + Plantomycin 15 g in 15 Litre water) to control Bacterial leaf blight in Paddy.,BARGARH,1
17432,AGRICULTURE,Cereals,Paddy (Dhan),	Plant Protection	,Gall midge in paddy,Recommended to spray Regent (Fipronil 5% SC) @ 2 ml/l to control Gall midge in paddy,BARGARH,1
17440,AGRICULTURE,Cereals,Paddy (Dhan),Fertilizer Use and Availability,Fertilizer management in paddy,After 21 days of transplanting apply 20kg urea+10kg zinc sulphate or maha zinc@5 kg or Dhanzyme gold (granule) @ 5 kg +Ferterra 0.4% GR (chlorantraniliprole) @ 4 kg,BARGARH,1
17441,AGRICULTURE,Cereals,Paddy (Dhan),Weed Management,Paraquat application in crop field,Advised to sprinkle water in the crop field .,BARGARH,1
17445,AGRICULTURE,Cereals,Paddy (Dhan),Weed Management,Weed management in paddy ,"Recommended to spray 2,4-D amine salt @ 400ml with 200 liter of water + apply Almix (Metsulfuron methyl 10% + Chlorimuron ethyl 10% WP) @ 8 g/200LIT water  for weed management in paddy.",BARGARH,1
17448,AGRICULTURE,Cereals,Paddy (Dhan),	Plant Protection	,Gall midge in paddy,Recommended to spray Chloropyriphos 20 EC @ 400 ml per 200 litre of water per 1 acre of land (2 ml per 1 litre water) to control Gall midge in Paddy,BARGARH,1
17456,AGRICULTURE,Cereals,Paddy (Dhan),	Plant Protection	,Yellow stem borer in paddy,Recommended to spray Canon (Cypermethrin - 5% + Chloropyriphos - 50% ) @ 400 ml per 200 litre of water per 1 acre of land to control Yellow stem borer in Paddy,BARGARH,1
17458,AGRICULTURE,Cereals,Paddy (Dhan),	Plant Protection	,Yellow stem borer in paddy,Recommended to spray Canon (Cypermethrin - 5% + Chloropyriphos - 50% ) @ 400 ml per 200 litre of water per 1 acre of land to control Yellow stem borer in Paddy,BARGARH,1
17460,AGRICULTURE,Cereals,Paddy (Dhan),Weed Management,Weed management in Paddy ,Advised to do hand weeding for Weed management in Paddy ,BARGARH,1
17464,AGRICULTURE,Cereals,Paddy (Dhan),	Plant Protection	,Stem borer in paddy,Recommended to spray Bayer Regent or Iffco Shinzan plus Fipronil 5% SC @ 400 ml per 200 litre of water per 1 acre of land (30ml in 15 litre water) ,BARGARH,1
17471,AGRICULTURE,Cereals,Paddy (Dhan),Nutrient Management,Paddy nutrient management,"Recommended to apply Urea @ 20 kg, Zinc sulphate @ 10 kg, Ferterra @ 4 kg , Dhanzyme gold (granule) @ 5 kg or IFFCO sagarika @ 10 kg per acre as second fertilizer dose in Paddy.",BARGARH,1
17472,AGRICULTURE,Cereals,Paddy (Dhan),	Plant Protection	,Rice yellow dwarf,Recommended to spray Sivanto Bayer (Flupyradifurone 17.09% SL) @ 2 ml per litre to control the Rice yellow dwarf.,BARGARH,1
17477,AGRICULTURE,Cereals,Paddy (Dhan),Weed Management, Balance dose in paddy ,"Recommended to apply MOP 15kg+Urea 40kg +Zypmite plus  25kg per acre as Balance dose in paddy 
",BARGARH,1
17479,AGRICULTURE,Cereals,Paddy (Dhan),	Plant Protection	,Rat problems in paddy field,--Recommended to prepare poison bait (90 gram wheat flour+ 5 gram edible oil + Aluminium phosphide @ 2-2.5 g) and place them near rat holes.,BARGARH,1
17484,AGRICULTURE,Cereals,Paddy (Dhan),	Plant Protection	,Gall midge in paddy,Recommended to spray Regent (Fipronil 5% SC) @ 2 ml/l to control Gall midge in paddy,BARGARH,1
17485,AGRICULTURE,Cereals,Paddy (Dhan),Fertilizer Use and Availability,Third top dressing fertiliser in Paddy,"
Recommended to apply Urea @ 20 kg and MOP @ 15 kg per acre as third top dressing fertiliser in Paddy.",BARGARH,1
17488,AGRICULTURE,Cereals,Paddy (Dhan),Nutrient Management,Leaf tip burning problem in paddy crops no disease and insect problem,Advise to apply potash fertilizer@15kg/acre or spray 0:0:50@100g/15lt of water ,BARGARH,1
17492,AGRICULTURE,Cereals,Paddy (Dhan),	Plant Protection	,Yellowing of rice tips ,Advise to wait some days as recently apply potash fertilizer,BARGARH,1
17494,AGRICULTURE,Cereals,Paddy (Dhan),	Plant Protection	,Bacterial leaf blight in Paddy,Recommended to spray Copper Oxychloride 600 g + Plantomycin 200 g in 200 litre of water per 1 acre of land (Copper Oxychloride @ 45 g + Plantomycin 15 g in 15 Litre water) to control Bacterial leaf blight in Paddy.,BARGARH,1
17504,AGRICULTURE,Cereals,Paddy (Dhan),	Plant Protection	,Bacterial leaf blight in Paddy,Recommended to spray Copper Oxychloride 600 g + Plantomycin 200 g in 200 litre of water per 1 acre of land (Copper Oxychloride @ 45 g + Plantomycin 15 g in 15 Litre water),BARGARH,1
17512,AGRICULTURE,Cereals,Paddy (Dhan),Weed Management,weed management in Paddy,"Recommended to spray 2,4-D Sodium salt @ 500gm + Almix (Metsulfuron Methyl 10% + Chlorimuron Ethyl 10%) @ 8gm with 200 liter of water per acre for weed management in Paddy.",BARGARH,1
17515,AGRICULTURE,Cereals,Paddy (Dhan),Weed Management,Weed management in paddy,Advise not to use any herbicide in paddy field,BARGARH,1
17517,AGRICULTURE,Cereals,Paddy (Dhan),Nutrient Management,Application of Zinc in Paddy ,"Application of Zinc in Paddy 

Fine white powder. Instantly soluble in water.
Contents. Zinc as Zn-EDTA = 15%
50 gm/ 100 gm/ 250 gm/ 500gm/ 1 kg.
Dosage. Foliar Spray – 1 gm per litre of water. Soil Application / Fertigation – 500 gm per acre.",BARGARH,1
17519,AGRICULTURE,Cereals,Paddy (Dhan),Weed Management,Post emergence weed in Paddy,"Recommended to apply Almix (Metsulfuron methyl 10% + Chlorimuron ethyl 10% WP) @ 8 g + 2,4- D @ 500 g + 20 kg sand to control Post emergence weed in Paddy.",BARGARH,1
17525,AGRICULTURE,Cereals,Paddy (Dhan),	Plant Protection	,Buprofezin usage ,"Advised to use for sucking pest , it is a systemic insecticide.",BARGARH,1
17533,AGRICULTURE,Cereals,Paddy (Dhan),	Plant Protection	,Sheath Rot in paddy ,Recommended to spray plantomycin 1gm+SAAF(Carbendazim 12%+mancozeb 63%)2gm  in 1liter  water to control Sheath Rot in paddy ,BARGARH,1
17535,AGRICULTURE,Cereals,Paddy (Dhan),	Plant Protection	,"Bacterial leaf blight in Paddy
","Recommended to spray plantomycin 1gm+copper oxychloride 50%wp 3gm in 1 litre water to control Bacterial leaf blight in Paddy
",BARGARH,1
17538,AGRICULTURE,Cereals,Paddy (Dhan),	Plant Protection	,Herbicide injury in paddy cropsWhat to do,Advise to spray npk19:19:19@100g/15lt of water ,BARGARH,1
17541,AGRICULTURE,Cereals,Paddy (Dhan),Weed Management,Weed management in paddy,Recommended to spray Bispyribac sodium 10% SC (Nominee gold) @ 80 ml per 200 litre of water per 1 acre of land (6 ml per 15 litre of water) as post emergence herbicide spray in Paddy. ,BARGARH,1
17545,AGRICULTURE,Cereals,Paddy (Dhan),	Plant Protection	,Root rot in paddy,--Recommended to soil drench with SAAF (Carbendazim- 12% + Mancozeb - 63% ) @ 600 g per 200 litre of water per 1 acre of land (3 g in 1 Litre water) to control Root rot in Paddy,BARGARH,1
17546,AGRICULTURE,Cereals,Paddy (Dhan),Weed Management,Wild rice management in paddy,Recommended to apply Agil (Propaquizafop 10% EC) @ 1 ml in 1 L of water to control the wild rice in paddy.,BARGARH,1
17552,AGRICULTURE,Cereals,Paddy (Dhan),Weed Management,Weed management in paddy,"Recommended to spray 2,4-D amine salt @ 400ml with 200 liter of water + apply Almix (Metsulfuron methyl 10% + Chlorimuron ethyl 10% WP) @ 8 g   for weed management in paddy.",BARGARH,1
17554,AGRICULTURE,Cereals,Paddy (Dhan),	Plant Protection	,Stem Borer in Paddy ,--Recommended to spray Fipronil 5%sc 30ml in 15 liters water to control Stem Borer in Paddy ,BARGARH,1
17557,AGRICULTURE,Cereals,Paddy (Dhan),Fertilizer Use and Availability,Second dosage fertilizer in paddy,"Recommended to apply Urea @ 20 kg, Zinc sulphate @ 10 kg or Maha zinc @ 5 kg and Ferterra @ 4 kg per acre as Second fertiliser dose in Paddy.",BARGARH,1
17560,AGRICULTURE,Cereals,Paddy (Dhan),	Plant Protection	,Gall midge in paddy ,"
Recommended to spray Fipronil 5% SC @ 400 ml per 200 litre of water per 1 acre of land (30ml in 15 litre water) for Gall midge in paddy ",BARGARH,1
17563,AGRICULTURE,Cereals,Paddy (Dhan),	Plant Protection	,Leaf blight in paddy,"Recommended to spray Copper Oxychloride 600 g + Plantomycin 200 g in 200 litre of water per 1 acre of land (Copper Oxychloride @ 45 g + Plantomycin 15 g in 15 Litre water) to control Bacterial leaf blight in Paddy.
",BARGARH,1
17565,AGRICULTURE,Cereals,Paddy (Dhan),Weed Management,Weed management in paddy,"Recommended to spray Bispyribac sodium 10%EC (Nominee gold, Fuzi super) @ 80ml with 200 liter of water per acre for weed management in paddy (6ml/15lit water).",BARGARH,1
17567,AGRICULTURE,Cereals,Paddy (Dhan),	Plant Protection	," Bacterial leaf blight in Paddy
","Recommended to spray Copper Oxychloride 600 g + Plantomycin 200 g in 200 litre of water per 1 acre of land (Copper Oxychloride @ 45 g + Plantomycin 15 g in 15 Litre water) to control Bacterial leaf blight in Paddy.
",BARGARH,1
17574,AGRICULTURE,Cereals,Paddy (Dhan),	Plant Protection	, Gall midge in Paddy ,Recommended to spray (Chloropyriphos 50 EC + Cypermethrin 5% EC ) @ 400 ml per 200 litre of water per 1 acre of land to control  Gall midge in Paddy ,BARGARH,1
17577,AGRICULTURE,Cereals,Paddy (Dhan),	Plant Protection	,Blast in paddy ,"Recommended to spray Tricyclazole 75 WP @ 9g per15 litre of water (120gm/200lit water) per 1 acre of land for control of blast in paddy.
",BARGARH,1
17582,AGRICULTURE,Cereals,Paddy (Dhan),	Plant Protection	,Stem borer in paddy,Advised to use imidacloprid 0.3 gr 6kg per acre for yellow stem borer in paddy.,BARGARH,1
17599,AGRICULTURE,Cereals,Paddy (Dhan),Fertilizer Use and Availability,Tillering dose in Paddy ,Recommended to apply 30 kg Urea+25 kg Zypmite per acre as Tillering dose in Paddy ,BARGARH,1
17602,AGRICULTURE,Cereals,Paddy (Dhan),	Plant Protection	,Stem borer in paddy ,Recommended to spray (Chloropyriphos 50 EC + Cypermethrin 5% EC ) @ 400 ml per 200 litre of water per 1 acre of land to control Stem borer in paddy ,BARGARH,1
17603,AGRICULTURE,Cereals,Paddy (Dhan),Weed Management,weed management in Paddy,"Recommended to spray Triafamone 20% + Ethoxysulfuron 10% WG (Council active) @ 100gm with 200 liter of water per acre for weed management in Paddy.
",BARGARH,1
17605,AGRICULTURE,Cereals,Paddy (Dhan),Fertilizer Use and Availability,  For better growth of paddy,Recommended to spray Multi K (13:0:45) @ 1500 gm per 200 litre of water per 1 acre of land (100 g / 15 liter) for better growth of paddy.,BARGARH,1
17606,AGRICULTURE,Cereals,Paddy (Dhan),	Plant Protection	,Stem borer in paddy ,"--
Recommended to spray (Chloropyriphos 50 EC + Cypermethrin 5% EC ) @ 400 ml per 200 litre of water per 1 acre of land to control Stem borer in paddy ",BARGARH,1
17607,AGRICULTURE,Cereals,Paddy (Dhan),Weed Management,Preemergence weed management in paddy can i apply 24d amine salt 58sl,"Yes you can apply and recommended to spray 2, 4- DIMETHYL AMINE SALT 58 % SL@400- 500 ml per 200 litre of water per 1 acre of land",BARGARH,1
17608,AGRICULTURE,Cereals,Paddy (Dhan),Fertilizer Use and Availability,For better growth of Paddy ,Recommended to spray Nano Urea 500ml in 200 liters water per acre for better growth of Paddy ,BARGARH,1
17609,AGRICULTURE,Cereals,Paddy (Dhan),	Plant Protection	,Sheath rot in Paddy ,Recommended to spray Hexaconazole 5%sc 30ml in 15 liters water to control Sheath rot in Paddy ,BARGARH,1
17612,AGRICULTURE,Cereals,Paddy (Dhan),	Plant Protection	,White fly in paddy,Recommended to spray Fipronil 5% SC @ 400 ml per 200 litre of water per 1 acre of land (30ml in 15 litre water) to control white fly in paddy.,BARGARH,1
17613,AGRICULTURE,Cereals,Paddy (Dhan),	Plant Protection	,Stem borer in paddy,"Recommended to spray Fipronil 5% SC @ 400 ml per 200 litre of water per 1 acre of land (30ml in 15 litre water) 
  ",BARGARH,1
17616,AGRICULTURE,Cereals,Paddy (Dhan),	Plant Protection	,Case worm in paddy,Recommended to spray Fipronil 5% SC @ 400 ml per 200 litre of water per 1 acre of land (30ml in 15 litre water) to control case worm in paddy. ,BARGARH,1
17632,AGRICULTURE,Cereals,Paddy (Dhan),Nutrient Management,Nutrient management in paddy ,After 21 days of transplanting apply 20kg urea+10kg zinc sulphate or maha zinc@5 kg or Dhanzyme gold (granule) @ 5 kg or Iffco Sagarika z++ @ 8-10 kg per acre  +Ferterra 0.4% GR (chlorantraniliprole) @ 4 kg or  Virtako(syngenta) (Thiamethoxam 1% + Chlorantraniliprole 0.5% GR)@2.5 kg,BARGARH,1
17633,AGRICULTURE,Cereals,Paddy (Dhan),Varieties,Duration of ajay paddy variety,Duration of ajay paddy variety-125 to 135 days ,BARGARH,1
17639,AGRICULTURE,Cereals,Paddy (Dhan),	Plant Protection	,Blast in Paddy,Recommended to spray Tricyclazole 75 WP @ 130 g per 200 litre of water per 1 acre of land to control Blast in Paddy,BARGARH,1
17641,AGRICULTURE,Cereals,Paddy (Dhan),Weed Management,weed management in paddy,Recommended to spray Whipsuper @ 300 ml + Almix @ 8 gram per 200 litre of water per acre of land to control weed from paddy field after 20 days of  transplanting,BARGARH,1
17642,AGRICULTURE,Cereals,Paddy (Dhan),	Plant Protection	,Yellow stem borer in Paddy,Recommended to spray syngenta Simodis @ 6 ml per 15 litre of water to control Yellow stem borer in Paddy,BARGARH,1
17644,AGRICULTURE,Cereals,Paddy (Dhan),Nutrient Management,2nd nutrient management in paddy , Apply 20kg urea+10kg zinc sulphate or maha zinc@5 kg or Dhanzyme gold (granule) @ 5 kg or Iffco Sagarika z++ @ 8-10 kg per acre  +Ferterra 0.4% GR (chlorantraniliprole) @ 4 kg or  Virtako(syngenta) (Thiamethoxam 1% + Chlorantraniliprole 0.5% GR)@2.5 kg,BARGARH,1
17645,AGRICULTURE,Cereals,Paddy (Dhan),Weed Management,Herbicide injury in paddy crops ,Advise to spray NPK19;19:19@100g/15lt of water.,BARGARH,1
17646,AGRICULTURE,Others,Others,	Plant Protection	,What is the duration of  effect of Cartap hydrochloride 4G and Ferterra 04 GR in paddy crop after application ,Duration of  effect of Cartap hydrochloride 4G and Ferterra 0.4% GR in paddy crop after application 30-40 days ,BARGARH,1
17649,AGRICULTURE,Cereals,Paddy (Dhan),	Plant Protection	,Bacterial leaf blight in Paddy,"Recommended to spray Copper Oxychloride 600 g + Plantomycin 200 g in 200 litre of water per 1 acre of land (Copper Oxychloride @ 45 g + Plantomycin 15 g in 15 Litre water) to control Bacterial leaf blight in Paddy.
",BARGARH,1
17650,AGRICULTURE,Cereals,Paddy (Dhan),	Plant Protection	,Gall midge in paddy ,"Recommended to spray Fipronil 5% SC @ 400 ml per 200 litre of water per 1 acre of land (30ml in 15 litre water) 
 or Dose of  Fipronil 40 % + Imidacloprid 40 % wg for cotton @6-7 Gram in 15 Liter Water",BARGARH,1
17653,AGRICULTURE,Cereals,Paddy (Dhan),	Plant Protection	,Bacterial leaf blight in paddy,Recommended to spray Copper Oxychloride 600 g + Plantomycin 200 g in 200 litre of water per 1 acre of land (Copper Oxychloride @ 45 g + Plantomycin 15 g in 15 Litre water),BARGARH,1
17656,AGRICULTURE,Cereals,Paddy (Dhan),	Plant Protection	,Gall midge and rice hispa  in paddy ,"Recommended to spray Thiamethoxam 12.6% + Lambda cyhalothrin 4%SL (Alika) @ 80ml with 200 liter of water per acre .or Recommended to spray Chlorantraniliprole 8.8% W/W + Thiamethoxam 17.5 % W/W SC @ 60 gm per 200 litre of water 
",BARGARH,1
17658,AGRICULTURE,Cereals,Paddy (Dhan),	Plant Protection	, Stem borer in Paddy ,Recommended to spray Caldan 50%sp  30gm in 15 liters water  to control Stem borer in Paddy ,BARGARH,1
17659,AGRICULTURE,Cereals,Paddy (Dhan),Weed Management,Algal growth in Paddy field,Recommended to apply Copper sulphate @ 4 kg per acre mixed with 20 kg sand before sowing to control Algal growth in Paddy field. ,BARGARH,1
17662,AGRICULTURE,Cereals,Paddy (Dhan),Weed Management,Faulty application of Weedicide,Advised to wait for somedays for recovery of plant. If it recovers then advised to apply olyfeed (19-19-19) @ 6g with 1 liter of water for good growth of plant.,BARGARH,1
17667,AGRICULTURE,Cereals,Paddy (Dhan),Fertilizer Use and Availability,Fertilizer management in paddy,Recommended to apply 15kg mop 10kg zinc sulphate or maha zinc@5 kg or Dhanzyme gold (granule) @ 5 kg +Ferterra 0.4% GR (chlorantraniliprole) @ 4 kg,BARGARH,1
17673,AGRICULTURE,Cereals,Paddy (Dhan),Weed Management," Post emergence weeds in paddy 
","Recommended to spray Whip Super (Fenoxaprop-p-ethyl 9.3% EC)+ml+ ( Bispyribac-Sodium 10% SC)20ml in 15liters water to control  to control Post emergence weeds in paddy 
",BARGARH,1
17674,AGRICULTURE,Cereals,Paddy (Dhan),Fertilizer Use and Availability,Balance  dose in paddy ,Recommended 35kg DAP+15 kg MOP+40kg Urea+25 kg Zypmite plus per acre as Balance  dose in paddy ,BARGARH,1
17680,AGRICULTURE,Cereals,Paddy (Dhan),	Plant Protection	,Bacterial leaf blight in Paddy,Recommended to spray Copper Oxychloride 600 g + Plantomycin 200 g in 200 litre of water per 1 acre of land (Copper Oxychloride @ 45 g + Plantomycin 15 g in 15 Litre water),BARGARH,1
17686,AGRICULTURE,Cereals,Paddy (Dhan),	Plant Protection	,Stem borer in Paddy ,Recommended to spray Fipronil 5% SC @ 400 ml per 200 litre of water per 1 acre of land (30ml in 15 litre water) to control Stem borer in Paddy ,BARGARH,1
17690,AGRICULTURE,Cereals,Paddy (Dhan),	Plant Protection	,Stem borer in paddy ,Recommended to apply Syngenta Virtako (Thiomethoxam+Chlorantraniliprole) @ 2.5 kg per acre per acre mixing with 12kg sand in paddy,BARGARH,1
17691,AGRICULTURE,Cereals,Paddy (Dhan),Fertilizer Use and Availability,Fertilizer dose for paddy,"Recommended to apply Urea @ 20 kg,Zinc sulphate @ 10 kg",BARGARH,1
17699,AGRICULTURE,Cereals,Paddy (Dhan),	Plant Protection	,stem borer in paddy,Recommended to spray Emamectin benzoate 5%SG @ 6gm with 15liter of water for control of  stem borer in paddy.,BARGARH,1
17706,AGRICULTURE,Cereals,Paddy (Dhan),	Plant Protection	,Dose of  Tricyclazole 75 WP as blast  prevention in paddy  ,"Recommended to spray Tricyclazole 75 WP @ 130 g per 200 litre of water per 1 acre of land to control Blast in Paddy
",BARGARH,1
17707,AGRICULTURE,Cereals,Paddy (Dhan),	Plant Protection	,Stem borer in paddy ,Recommended to spray Chloropyriphos 50% + Cypermethrin 5% EC @ 400 ml per 200 litre of water per  1 acre of land+ Syngenta virtako @ 2.5 kg per acre ,BARGARH,1
17709,AGRICULTURE,Cereals,Paddy (Dhan),	Plant Protection	,To kill Rats in Field,Recommended to apply Rodenticide(zinc sulphate) to kill Rats in Field,BARGARH,1
17713,AGRICULTURE,Cereals,Paddy (Dhan),	Plant Protection	,Stem borer in Paddy ,Recommended to spray Fipronil 5%sc 30ml in 15 liters water to control Stem borer in Paddy ,BARGARH,1
17721,AGRICULTURE,Cereals,Paddy (Dhan),Weed Management,Weed management in paddy,Advised to go for hand weeding.,BARGARH,1
17729,AGRICULTURE,Cereals,Paddy (Dhan),	Plant Protection	,stem borer in paddy,Recommended to spray Dhanuka Marker or Iffco Hamada ( Bifenthrin 10 % EC ) @ 500 ml per 200 litre of water per 1 acre of land ,BARGARH,1
17731,AGRICULTURE,Cereals,Paddy (Dhan),	Plant Protection	,Spiny beetle Rice hispa  in paddy ,"
Recommended to spray Emamectin Benzoate 5 % SG @ 80 g per 200 litre of water per 1 acre of land (6 g per 15 Litre water)",BARGARH,1
17732,AGRICULTURE,Cereals,Paddy (Dhan),	Plant Protection	,Green leafhopper in paddy ,Recommended to spray Thiamethoxam 12.6% + Lambda cyhalothrin 4%SL (Alika) @ 80ml with 200 liter of water per acre,BARGARH,1
17733,AGRICULTURE,Cereals,Paddy (Dhan),	Plant Protection	,Bacterial leaf blight in paddy,"Recommended to spray Copper Oxychloride 600 g + Plantomycin 200 g in 200 litre of water per 1 acre of land (Copper Oxychloride @ 45 g + Plantomycin 15 g in 15 Litre water) to control Bacterial leaf blight in Paddy.
",BARGARH,1
17737,AGRICULTURE,Cereals,Paddy (Dhan),	Plant Protection	,gall mese in paddy,Recommended to spray Fipronil 5% SC @ 400 ml per 200 litre of water per 1 acre of land (30ml in 15 litre water) ,BARGARH,1
17750,AGRICULTURE,Cereals,Paddy (Dhan),	Plant Protection	,Poor plant growth in Paddy,"Urea- 10kg, MOP- 15kg, Zinc sulphate- 10kg, Virtako- 2.5kg per acre.",BARGARH,1
17758,AGRICULTURE,Cereals,Paddy (Dhan),	Plant Protection	, Stem borer in paddy ,Recommended to spray Caldan 50%sp 30gm in 15 liters water to control Stem borer in paddy ,BARGARH,1
17759,AGRICULTURE,Cereals,Paddy (Dhan),	Plant Protection	,Stem borer in paddy ,Advised call after proper diagonosis of the plant.,BARGARH,1
17767,AGRICULTURE,Cereals,Paddy (Dhan),	Plant Protection	,Stem borer in Paddy ,"Recommended to spray Fipronil 5% SC @ 400 ml per 200 litre of water per 1 acre of land (30ml in 15 litre water) to control Stem borer in Paddy 
  ",BARGARH,1
17778,AGRICULTURE,Cereals,Paddy (Dhan),Fertilizer Use and Availability,Fertilizer dose for paddy,"Recommended the fertilizer dose for paddy urea-30kg, zinc sulphate-10kg, fertersa-4kg/acre.",BARGARH,1
17787,AGRICULTURE,Cereals,Paddy (Dhan),	Plant Protection	,White fly in paddy,Recommended to apply Syngenta Virtako (Thiomethoxam+Chlorantraniliprole) @ 2.5 kg per acre per acre mixing with 12kg sand in paddy to control white fly in paddy. ,BARGARH,1
17797,AGRICULTURE,Cereals,Paddy (Dhan),	Plant Protection	, Root rot in Paddy,Recommended to spray Ridomil gold ( Metalaxyl-m  4% w/w + Mancozeb - 64% w/w ) @ 500 g per 200 litre of water per 1 acre of land (2.5 gm / 1 liter of water) to control Root rot in Paddy.,BARGARH,1
17798,AGRICULTURE,Cereals,Paddy (Dhan),Weed Management,Weed management in paddy,Advised to go for hand weeding.,BARGARH,1
17801,AGRICULTURE,Cereals,Paddy (Dhan),	Plant Protection	,About Fipronil 5 SC  dose in paddy ,Recommended to spray Fipronil 5% SC @ 400 ml per 200 litre of water per 1 acre of land (30ml in 15 litre water),BARGARH,1
17803,AGRICULTURE,Cereals,Paddy (Dhan),	Plant Protection	,Bacterial leaf blight in paddy ,Recommended to spray Copper Oxychloride 600 g + Plantomycin 200 g in 200 litre of water per 1 acre of land (Copper Oxychloride @ 45 g + Plantomycin 15 g in 15 Litre water) to control Bacterial leaf blight in Paddy.,BARGARH,1
17812,AGRICULTURE,Cereals,Paddy (Dhan),	Plant Protection	,Stem borer Leaf folder thrips  case worm in Paddy,"
Recommended to spray (Shooter 50 )Lambda Cyhalothrin 4.9 % CS @ 400 ml per 200 litre of water in 1 acre of land to control Stem borer, Leaf folder, thrips , case worm in Paddy",BARGARH,1
17816,AGRICULTURE,Cereals,Paddy (Dhan),	Plant Protection	,Bacterial leaf blight in Paddy,"Recommended to spray  Copper Oxychloride 50% WG @ 600 gm + Plantomycin ( Streptomycin sulphate 9% + Tetracycline Hydrochloride 1% ) 200 gm in 200 litre of water per 1 acre of land 
",BARGARH,1
17821,AGRICULTURE,Cereals,Paddy (Dhan),	Plant Protection	,Gall midge in Paddy,--Recommended to spray Fipronil 5% SC @ 400 ml per 200 litre of water per 1 acre of land (30ml in 15 litre water) ,BARGARH,1
17841,AGRICULTURE,Cereals,Paddy (Dhan),	Plant Protection	, Leaf folder in Paddy,Recommended to spray Fipronil 5% SC @ 400 ml per 200 litre of water per 1 acre of land (30ml in 15 litre water) to control Leaf folder in Paddy,BARGARH,1
